{
 "schema_version": "1.0.0",
 "generated_by": "scripts/build_dataset_index.py",
 "description": "All datasets described in this repository, one row each, with normalized license and access fields. Generated from the topic files; edit those, not this file.",
 "count": 34,
 "datasets": [
  {
   "id": "bathing-waters-de",
   "name": "Badestellen und Badegewaesser Deutschland",
   "topic": "directory-candidates",
   "kind": "directory_candidate",
   "url": "https://sdi.eea.europa.eu/catalogue/datahub/api/records/070d9baa-448d-4168-8514-7dadb3ad876d",
   "download_url": "https://sdi.eea.europa.eu/datashare/s/sptXqwkQr5g7Bp5/download?path=/eea_t_bathing-water-status_p_1990-2025_v01_r00&files=bw_assessment_eea_datahub_1990_2025.xlsx",
   "formats": [
    "XLSX",
    "XLS"
   ],
   "access": "bulk_download",
   "license_id": "CC-BY-4.0",
   "license_note": null,
   "license_evidence_url": "https://sdi.eea.europa.eu/catalogue/datahub/api/records/070d9baa-448d-4168-8514-7dadb3ad876d",
   "commercial_use": "yes",
   "attribution_required": true,
   "share_alike": false,
   "count_value": 2291,
   "count_relation": "eq",
   "count_unit": "reported_bathing_water",
   "count_scope": "Germany, reported bathing waters in season 2025",
   "count_basis": "official_scope_statistic",
   "measured_record_count": 2291,
   "measured_unique_ids": 2291,
   "measured_at": "2026-10-28",
   "documentation_checked_at": "2026-10-23",
   "doc": "docs/strategy/DIRECTORY_PROJECT_PRIORITIES.md",
   "notes": "2291 is the official country stock, not our imported spreadsheet row count. The documented classification is historical, not today's bathing permission or water safety. Parking, toilets, dogs and opening hours need independent sources. Seasonal demand; October launch is not a promise of immediate summer traffic."
  },
  {
   "id": "museums-fr",
   "name": "Musees de France: Museumsverzeichnis",
   "topic": "directory-candidates",
   "kind": "directory_candidate",
   "url": "https://www.data.gouv.fr/datasets/musees-de-france-base-museofile",
   "download_url": "https://ministere-culture.s3.sbg.io.cloud.ovh.net/POP/museofile.csv",
   "formats": [
    "CSV"
   ],
   "access": "bulk_download",
   "license_id": "Etalab-2.0",
   "license_note": null,
   "license_evidence_url": "https://www.data.gouv.fr/datasets/musees-de-france-base-museofile",
   "commercial_use": "yes",
   "attribution_required": true,
   "share_alike": false,
   "count_value": 1200,
   "count_relation": "gt",
   "count_unit": "museum",
   "count_scope": "Musees de France recorded in Museofile; not all museums worldwide",
   "count_basis": "publisher_dataset_count",
   "measured_record_count": 1216,
   "measured_unique_ids": 1216,
   "measured_at": "2026-10-28",
   "documentation_checked_at": "2026-10-23",
   "doc": "docs/strategy/DIRECTORY_PROJECT_PRIORITIES.md",
   "notes": "The publisher says more than 1200, not exactly 1200. French inventory; German-language tourist targeting does not make these German locations. No universal verified opening-hours, ticket-price or image-rights coverage. The older list-and-location dataset is archived; use the current Museofile release."
  },
  {
   "id": "schools-nrw",
   "name": "Schulverzeichnis Nordrhein-Westfalen",
   "topic": "directory-candidates",
   "kind": "directory_candidate",
   "url": "https://www.schulministerium.nrw/open-data",
   "download_url": "https://www.schulministerium.nrw.de/BiPo/OpenData/Schuldaten/schuldaten.csv",
   "formats": [
    "CSV",
    "XML"
   ],
   "access": "bulk_download",
   "license_id": "DL-DE-BY-2.0",
   "license_note": null,
   "license_evidence_url": "https://www.schulministerium.nrw/open-data",
   "commercial_use": "yes",
   "attribution_required": true,
   "share_alike": false,
   "count_value": 5418,
   "count_relation": "eq",
   "count_unit": "school",
   "count_scope": "NRW public and private replacement schools, school year 2025/26; excludes supplementary and healthcare schools",
   "count_basis": "official_scope_statistic",
   "measured_record_count": 5645,
   "measured_unique_ids": 5645,
   "measured_at": "2026-10-28",
   "documentation_checked_at": "2026-10-23",
   "doc": "docs/strategy/DIRECTORY_PROJECT_PRIORITIES.md",
   "notes": "5418 is official school-year population, not a counted live export. 2817 primary schools is a subset in the same report, not another independent project stock. The daily export may have a different date and scope; reconcile during import. No admission availability or school-quality inference from location or social indicators."
  },
  {
   "id": "food-hygiene-westminster",
   "name": "Lebensmittelbetriebe und Hygienebewertungen Westminster",
   "topic": "directory-candidates",
   "kind": "directory_candidate",
   "url": "https://ratings.food.gov.uk/open-data",
   "download_url": "https://ratings.food.gov.uk/api/open-data-files/FHRS533en-GB.xml",
   "formats": [
    "XML",
    "JSON API"
   ],
   "access": "bulk_download",
   "license_id": "OGL-3.0",
   "license_note": null,
   "license_evidence_url": "https://ratings.food.gov.uk/terms-and-conditions",
   "commercial_use": "yes",
   "attribution_required": true,
   "share_alike": false,
   "count_value": 5779,
   "count_relation": "eq",
   "count_unit": "food_business",
   "count_scope": "Westminster XML download, all included food-business types",
   "count_basis": "publisher_dataset_count",
   "measured_record_count": 5779,
   "measured_unique_ids": 5779,
   "measured_at": "2026-10-28",
   "documentation_checked_at": "2026-10-23",
   "doc": "docs/strategy/DIRECTORY_PROJECT_PRIORITIES.md",
   "notes": "5779 includes shops, hotels and other food establishments, not only restaurants. Countrywide FSA stock is broader and is not added to the Westminster subset. Some private addresses and coordinates are withheld. Use current rating or show update date; official logos and rating imagery have additional restrictions. Free official search is an established competitor; no ranking advantage demonstrated."
  },
  {
   "id": "research-organisations-de",
   "name": "Forschungsnahe Organisationen Deutschland",
   "topic": "directory-candidates",
   "kind": "directory_candidate",
   "url": "https://ror.readme.io/docs/data-dump",
   "download_url": "https://api.ror.org/v2/organizations?filter=country.country_code:DE",
   "formats": [
    "JSON",
    "CSV",
    "JSON API"
   ],
   "access": "api",
   "license_id": "CC0-1.0",
   "license_note": null,
   "license_evidence_url": "https://ror.readme.io/docs/data-dump",
   "commercial_use": "yes",
   "attribution_required": false,
   "share_alike": false,
   "count_value": 5878,
   "count_relation": "eq",
   "count_unit": "organisation",
   "count_scope": "ROR API v2 default active result set, meta.countries entry id=de",
   "count_basis": "api_country_facet",
   "measured_record_count": 5878,
   "measured_unique_ids": null,
   "measured_at": "2026-10-28",
   "documentation_checked_at": "2026-10-23",
   "doc": "docs/strategy/DIRECTORY_PROJECT_PRIORITIES.md",
   "notes": "5878 is directly observed API facet output, not a downloaded German corpus. The global response contains mixed organisation types; these are not 5878 universities or commercial laboratories. GeoNames locations can represent city centres, not entrances or street addresses. Dump includes inactive and withdrawn records unless explicitly filtered. Use a full release for exhaustive country selection; filter-only pagination can miss or repeat records."
  },
  {
   "id": "historic-monuments-fr",
   "name": "Historischer Denkmalatlas Frankreich",
   "topic": "directory-candidates",
   "kind": "directory_candidate",
   "url": "https://www.data.gouv.fr/datasets/immeubles-proteges-au-titre-des-monuments-historiques-2",
   "download_url": "https://ministere-culture.s3.sbg.io.cloud.ovh.net/POP/merimee.csv",
   "formats": [
    "CSV",
    "GeoJSON"
   ],
   "access": "bulk_download",
   "license_id": "Etalab-2.0",
   "license_note": null,
   "license_evidence_url": "https://www.data.gouv.fr/datasets/immeubles-proteges-au-titre-des-monuments-historiques-2",
   "commercial_use": "yes",
   "attribution_required": true,
   "share_alike": false,
   "count_value": 45080,
   "count_relation": "eq",
   "count_unit": "protected_immovable_property",
   "count_scope": "Protected immovable properties in France as of 2024-01-01; historical scope, not current CSV rows",
   "count_basis": "official_scope_statistic",
   "measured_record_count": 46761,
   "measured_unique_ids": 46761,
   "measured_at": "2026-10-28",
   "documentation_checked_at": "2026-10-23",
   "doc": "docs/strategy/DIRECTORY_PROJECT_PRIORITIES.md",
   "notes": "45080 is a dated protected-property statistic, not a live count of records or open visitor attractions. The current dataset includes formerly protected properties; scope must not be silently narrowed to currently protected only. Some records lack coordinates; private properties may not be accessible. Images need separate rights review; translation and editorial checking add effort."
  },
  {
   "id": "edu-mein-now",
   "name": "mein NOW",
   "topic": "education",
   "kind": "source_profile",
   "url": "https://mein-now.de/privatpersonen/weiterbildungen",
   "download_url": null,
   "formats": [
    "HTML"
   ],
   "access": "search_only",
   "license_id": "unknown",
   "license_note": null,
   "license_evidence_url": null,
   "commercial_use": "unknown",
   "attribution_required": null,
   "share_alike": null,
   "count_value": null,
   "count_relation": null,
   "count_unit": null,
   "count_scope": null,
   "count_basis": null,
   "measured_record_count": null,
   "measured_unique_ids": null,
   "measured_at": null,
   "documentation_checked_at": "2026-10-22",
   "doc": "docs/education/WEITERBILDUNG_DE_AZAV.md",
   "notes": "Kurseintrag und Foerderhinweis sind kein geprueftes Massnahmezertifikat."
  },
  {
   "id": "edu-kursnet-openqcat",
   "name": "KURSNET / open-Qcat",
   "topic": "education",